{"schema_version":"basket-1.0","id":"mali-1682-basket-ration_v1","country":{"id":"mali","name":"Mali"},"market":{"id":1682,"name":"Kati"},"basket":{"basket_id":"ration_v1","per":"person-month","components":[{"component":"cereal","commodity":"Millet","commodity_fr":"Mil","quantity":12.0,"unit":"KG"}],"missing":["pulses","oil"],"definition":"ration-based (WFP general ration), not an official minimum expenditure basket"},"currency":"XOF","eligible":true,"dates":{"forecast_origin":"2026-10","data_up_to":"2026-08","last_observed_month":"2026-08","run_at":"2026-10-26T06:03:46.215058"},"history":[{"month":"2014-06","cost":3000.0},{"month":"2014-07","cost":3000.0},{"month":"2014-08","cost":2940.0},{"month":"2014-09","cost":3000.0},{"month":"2014-10","cost":3000.0},{"month":"2014-11","cost":2928.0},{"month":"2014-12","cost":2904.0},{"month":"2015-01","cost":2700.0},{"month":"2015-02","cost":2928.0},{"month":"2015-03","cost":2664.0},{"month":"2015-04","cost":2784.0},{"month":"2015-05","cost":2448.0},{"month":"2015-06","cost":2748.0},{"month":"2015-07","cost":2652.0},{"month":"2015-08","cost":2712.0},{"month":"2015-10","cost":2748.0},{"month":"2015-11","cost":2352.0},{"month":"2015-12","cost":2520.0},{"month":"2016-01","cost":2400.0},{"month":"2016-02","cost":2400.0},{"month":"2016-03","cost":2400.0},{"month":"2016-04","cost":2400.0},{"month":"2016-05","cost":2400.0},{"month":"2016-06","cost":2400.0},{"month":"2016-07","cost":2400.0},{"month":"2016-08","cost":2400.0},{"month":"2016-09","cost":2400.0},{"month":"2016-10","cost":2400.0},{"month":"2016-11","cost":2700.0},{"month":"2016-12","cost":2556.0},{"month":"2017-01","cost":2400.0},{"month":"2017-02","cost":2400.0},{"month":"2017-03","cost":2400.0},{"month":"2017-04","cost":2580.0},{"month":"2017-05","cost":2856.0},{"month":"2017-06","cost":3000.0},{"month":"2017-07","cost":3000.0},{"month":"2017-08","cost":3216.0},{"month":"2017-09","cost":3300.0},{"month":"2017-10","cost":3300.0},{"month":"2017-11","cost":3300.0},{"month":"2017-12","cost":3300.0},{"month":"2018-01","cost":3000.0},{"month":"2018-02","cost":3000.0},{"month":"2018-03","cost":3000.0},{"month":"2018-04","cost":3000.0},{"month":"2018-05","cost":3000.0},{"month":"2018-06","cost":3000.0},{"month":"2018-07","cost":3000.0},{"month":"2018-08","cost":3000.0},{"month":"2018-09","cost":3000.0},{"month":"2018-10","cost":3000.0},{"month":"2018-11","cost":3000.0},{"month":"2018-12","cost":2700.0},{"month":"2019-01","cost":3000.0},{"month":"2019-02","cost":2700.0},{"month":"2019-03","cost":2616.0},{"month":"2019-04","cost":2616.0},{"month":"2019-05","cost":2472.0},{"month":"2019-06","cost":2400.0},{"month":"2019-07","cost":2400.0},{"month":"2019-08","cost":2400.0},{"month":"2019-09","cost":2400.0},{"month":"2019-10","cost":2400.0},{"month":"2019-11","cost":2400.0},{"month":"2019-12","cost":2400.0},{"month":"2020-01","cost":2400.0},{"month":"2020-02","cost":2400.0},{"month":"2020-03","cost":2400.0},{"month":"2020-04","cost":2400.0},{"month":"2020-05","cost":2400.0},{"month":"2020-06","cost":2400.0},{"month":"2020-07","cost":2400.0},{"month":"2020-08","cost":2520.0},{"month":"2020-09","cost":2700.0},{"month":"2020-10","cost":2700.0},{"month":"2020-11","cost":2760.0},{"month":"2020-12","cost":2700.0},{"month":"2021-01","cost":2700.0},{"month":"2021-02","cost":2700.0},{"month":"2021-03","cost":2628.0},{"month":"2021-04","cost":2400.0},{"month":"2021-05","cost":2400.0},{"month":"2021-06","cost":2400.0},{"month":"2021-07","cost":2400.0},{"month":"2021-08","cost":2400.0},{"month":"2021-09","cost":2700.0},{"month":"2021-10","cost":2700.0},{"month":"2021-11","cost":3156.0},{"month":"2021-12","cost":3600.0},{"month":"2022-01","cost":3600.0},{"month":"2022-02","cost":3672.0},{"month":"2022-03","cost":3900.0},{"month":"2022-04","cost":4500.0},{"month":"2022-05","cost":4680.0},{"month":"2022-06","cost":4800.0},{"month":"2022-07","cost":4800.0},{"month":"2022-08","cost":5100.0},{"month":"2022-09","cost":5400.0},{"month":"2022-10","cost":5400.0},{"month":"2022-11","cost":5100.0},{"month":"2022-12","cost":4200.0},{"month":"2023-02","cost":4200.0},{"month":"2023-03","cost":4200.0},{"month":"2023-04","cost":4200.0},{"month":"2023-05","cost":4200.0},{"month":"2023-06","cost":3756.0},{"month":"2023-07","cost":3840.0},{"month":"2023-08","cost":3900.0},{"month":"2023-09","cost":3900.0},{"month":"2023-10","cost":3780.0},{"month":"2023-11","cost":3600.0},{"month":"2024-01","cost":3300.0},{"month":"2024-03","cost":3600.0},{"month":"2024-04","cost":3600.0},{"month":"2024-05","cost":3600.0},{"month":"2024-06","cost":3840.0},{"month":"2024-07","cost":4500.0},{"month":"2024-08","cost":4800.0},{"month":"2024-09","cost":4800.0},{"month":"2024-10","cost":5100.0},{"month":"2024-11","cost":5100.0},{"month":"2024-12","cost":4680.0},{"month":"2025-01","cost":4200.0},{"month":"2025-02","cost":4200.0},{"month":"2025-03","cost":4200.0},{"month":"2025-04","cost":4200.0},{"month":"2025-05","cost":4200.0},{"month":"2025-06","cost":4200.0},{"month":"2025-07","cost":3750.0},{"month":"2025-08","cost":3900.0},{"month":"2025-09","cost":3828.0},{"month":"2025-10","cost":3600.0},{"month":"2025-12","cost":3600.0},{"month":"2026-01","cost":3600.0},{"month":"2026-02","cost":3600.0},{"month":"2026-03","cost":3600.0},{"month":"2026-04","cost":3600.0},{"month":"2026-05","cost":3540.0},{"month":"2026-06","cost":3300.0},{"month":"2026-07","cost":3300.0},{"month":"2026-08","cost":2400.0}],"forecast":[{"month":"2026-09","step":1,"horizon":"nowcast_last_month","p025":2214.64,"p10":2344.75,"p50":2647.81,"p90":3756.58,"p975":4318.93},{"month":"2026-10","step":2,"horizon":"nowcast_this_month","p025":2147.88,"p10":2287.18,"p50":2654.75,"p90":4097.39,"p975":4400.53},{"month":"2026-11","step":3,"horizon":"next_month","p025":1963.28,"p10":2230.35,"p50":2657.08,"p90":4208.95,"p975":4638.33},{"month":"2026-12","step":4,"horizon":"in_2_months","p025":1991.11,"p10":2139.47,"p50":2610.22,"p90":4332.62,"p975":5310.64},{"month":"2027-01","step":5,"horizon":"in_3_months","p025":1892.61,"p10":2099.52,"p50":2576.42,"p90":4270.43,"p975":5292.96}],"explanation":{"en":"A staple basket for one person for one month (12 kg Millet) cost about 2,400 XOF in August 2026. November 2026: most likely between 2,230 and 4,209 XOF (8 in 10 chance). January 2027: most likely between 2,100 and 4,270 XOF (8 in 10 chance). Not included: pulses, cooking oil; WFP's price series for them here are missing or too short for a forecast. This is a simple ration-based basket made by Staple Signals, not an official minimum expenditure basket.","fr":"Un panier de base pour une personne pendant un mois (12 kg Mil) coûtait environ 2 400 XOF en août 2026. Novembre 2026 : probablement entre 2 230 et 4 209 XOF (8 chances sur 10). Janvier 2027 : probablement entre 2 100 et 4 270 XOF (8 chances sur 10). Non inclus : légumineuses, huile ; les séries de prix du PAM sont absentes ou trop courtes ici pour une prévision. Il s'agit d'un panier simple fondé sur une ration, établi par Staple Signals, et non d'un panier minimum de dépenses officiel."},"attribution":"Source: World Food Programme (WFP), food prices via the Humanitarian Data Exchange (HDX), CC BY-IGO."}